,name,country,city,town,address,total space (sqft),colocation space (sqft),total power (MW)
714,China Telecom, China, Zhejiang Sheng, Quzhou Shi, Kecheng Qu,,,
715,China Telecom, China, Sichuan Sheng, Dazhou Shi, Dachuan Qu,,,
716,China Telecom, China, Guangdong Sheng, Shantou, Longhu Qu,,,
717,Zenlayer, 401120, China,Yubei,,,,
718,China Telecom, China, Jiangxi, Xinyu,Yushui,,,
719,China Telecom, China, Shandong, Zibo,Zhangdian,,,
720,Deft, Brazil, State of São Paulo,São Paulo,,,,
721,China Telecom, China, Zhejiang, Huzhou, Wuxing,,,
722,MOD Mission Critical, USA, NJ, Secaucus,275 Hartz Way,183900.0,131037.0,
723,MOD Mission Critical, Finland, 02630 Espoo,Sinimäentie 12,,7965.0,,
724,Prime Data Centers, USA, AZ, Avondale,11753 West Lower Buckeye Road,260400.0,128000.0,48.0
725,China Telecom, China, Guangdong Sheng, Huizhou Shi, Huicheng Qu,,,
726,China Telecom, USA, NY 10311, Staten Island,7 Teleport Dr,,,
727,Netshop ISP, Cyprus, Paphos, Agia Varvara,Anatoliko Industrial Zone,,,
728,China Telecom, China, Beijing, Chaoyang, Dongtucheng Road,,,
729,China Telecom, China, Guangdong Sheng, Huizhou Shi, Huicheng Qu,,,
730,China Telecom, China, Chongqing Shi, Jiangbei Qu,Telecom Mansion,,,
731,Zenlayer, USA, CA 95054, Santa Clara,1350 Duane Ave,,,
732,China Telecom, UK, London,Isle of Dogs,,,,
733,Netshop ISP, USA, DC,Washington D.C.,,,,
734,China Telecom, China, Beijing, Chaoyang,Guangqu Rd,,,
735,China Telecom, China, Zhejiang, Huzhou,Wuxing,,,
736,China Telecom, China, Jiangxi, Yingtan, Yuehu District,,,
737,Cologix, Canada, QC, Montreal,875 Rue Saint-Antoine Ouest,25000.0,,1.0
738,Tel Networks Inc., USA, MI, Detroit,1545 Clay Street,,,
739,Cologix, Canada, British Columbia, Vancouver,555 W Hastings St,,10800.0,1.6
740,China Telecom, USA, CA 95054, Santa Clara,1525 Comstock Street,,,
741,Lumen, USA, CA, Santa Clara,3045 Raymond Street,50000.0,17309.0,8.0
742,Prov.net/IronTrust Networks, USA, RI, Providence,935 Westminster Street,4000.0,2000.0,0.2
743,China Telecom, Germany, 60314 Frankfurt am Main,Hanauer Landstraße 298,,,,
744,China Telecom, 金桥路1493号, Pudong, Shanghai Shi,China,,,
745,Cogent Communications, France, Grenoble,33 Rue Joseph Chanrion,,,,
746,Limestone Networks, USA, FL, Miami,36 Northeast 2nd Street,,,
747,Equinix, Chile, Región Metropolitana, Pudahuel,Los Vientos 20239,43056.0,,
748,Enzu, USA, TX, Dallas,2323 Bryan Street,,,
749,DataBank, USA, WA, Seattle,2001 6th Avenue,,4040.0,0.21
750,China Telecom, 519085, China, Guangdong, Zhuhai,,,
751,Zenlayer, 100176, China, Beijing, Daxing,,,
752,TierPoint, USA, PA 18017, Bethlehem,3864 Courtney Street ste 130,25000.0,12000.0,
753,MOD Mission Critical, Costa Rica, San Pedro, San José, Roosevelt,,,
754,China Telecom, China, Jiangsu Sheng, Lianyungang Shi, Haizhou Qu,,,
755,Digital Realty, Kenya, Mombasa,Kongoni Road & Beach Rd,,18000.0,,3.9
756,Digital Realty, Hong Kong, Kwai Chung,11 Kin Chuen Street,,228000.0,,24.0
757,MOD Mission Critical, Australia, Alexandria NSW 2015,200 Bourke Road,,661722.0,,
758,Cogent Communications, USA, CA, San Diego,525 B Street,5307.0,5307.0,
759,China Telecom, China, Zhejiang, Taizhou, Jiaojiang District,,,
760,Lumen, USA, MN, Minneapolis,511 11th Avenue South,12291.0,3434.0,
761,China Telecom, UK, London E14 2AX, Poplar,East India Dock House,,,
762,H5 Data Centers, USA, NY, New York,325 Hudson Street,240000.0,,
763,Lumen, USA, MI, Southfield,19675 West 10 Mile Road,39357.0,7488.0,
764,Evocative, USA, CA 95054, Santa Clara,1525 Comstock Street,14800.0,,9.0
765,Lumen, USA, WA, Seattle,1000 Denny Way,48959.0,20376.0,
766,Prime Data Centers, USA, IL, Elk Grove Village,1601 Midway Ct,354000.0,156000.0,54.0
767,Lumen, USA, LA, New Orleans,1250 Poydras Street,9379.0,2500.0,
768,Cogent Communications, France, Strasbourg,46 Route de Bischwiller,,,,
769,"Carroll-Net, Inc.", USA, NJ, Hackensack,905 Main St,,,
770,Flexential, USA, VA 23227, Richmond,8851 Park Central Drive suite b,28594.0,10500.0,2.8
771,Flexential, USA, UT 84115, Salt Lake City,3949 South 200 East suite b1,36000.0,14713.0,1.92
772,Digital Realty, Brazil, 06268-120, São Paulo - SP, 350 - Vila Osasco,75000.0,,9.0
773,TierPoint, USA, WA 99019, Liberty Lake,23403 East Mission Avenue,32000.0,21000.0,
774,Lumen, USA, CA, West Sacramento,1075 Triangle Court,15000.0,24680.0,
775,Prov.net/IronTrust Networks, USA, MA, Chelmsford,187 Billerica Road,8000.0,5000.0,1.0
776,Enzu, USA, TX, Austin,205 W 9th St,,,
777,China Telecom, Brazil, 06455-000, Barueri - SP, 3641 - Tamboré,,,
778,Tel Networks Inc., USA, IL, Chicago,130 East Randolph Street,,,
779,DartPoints, USA, LA, Baton Rouge,7127 Florida Boulevard,27000.0,,
780,Psychz Networks, Brazil, 06460-120, Barueri - SP, 1900 - Res. Tambore,64260.0,,
781,Prime Data Centers, Denmark, 9300 Sæby,Energivej 1,,348751.0,145220.0,30.0
782,Tel Networks Inc., Canada, ON, Toronto,151 Front Street West,,,
783,CyrusOne,2501 Texas 121 Business,,,,200000.0,110000.0,26.5
784,Lumen, USA, OR, Beaverton,707 SW Washington Ave,4663.0,1321.0,
785,China Telecom, Australia, Ultimo NSW 2007,400 Harris Street,,,,
786,"Ascenty, a Digital Realty Company", Brazil, Paulínia - State of São Paulo,R. Sebastião Cardoso - Parque Brasil 500,,86000.0,,14.0
787,Digital Realty, Sweden, Kista,Esbogatan 11,,14107.0,,2.9
788,China Telecom, USA, CA 90012, Los Angeles,900 N Alameda St,,,
789,China Telecom, Germany, 65933 Frankfurt am Main,Lärchenstraße 110,,,,
790,Zenlayer, Malaysia, Federal Territory of Kuala Lumpur, 60000 Kuala Lumpur, Taman Tun Dr Ismail,,,
791,CyberNest, USA, CA 90245, El Segundo,445 North Douglas Street,,,
792,Psychz Networks, United Kingdom, London E14 9YY,240 E India Dock Rd,,705488.0,,
793,"Cato Digital, Inc", USA, NY, New York, Hudson Street,,,
794,Cogent Communications, USA, CA, Los Angeles,530 W 6th St,8400.0,8400.0,
795,Cologix, USA, TX, Dallas,1950 North Stemmons Freeway,28000.0,28000.0,
796,TierPoint, USA, OK, Tulsa,322 East Archer Street,36000.0,4000.0,
797,Enzu, USA, WA, Tukwila,12201 Tukwila International Boulevard,,,
798,DataBank, USA, KS, Lenexa,10605 West 84th Terrace,31000.0,11510.0,2.0
799,Digital Realty, USA, VA, Ashburn,43791 Devin Shafron Drive,135000.0,,12.0
800,Amazon AWS, China, Hebei, Langfang, Yongqing County,,,
801,Ixcellerate, Russia, Moscow, Dekabristov Ulitsa,Shosse,,21528.0,13.7
802,Racks Central, 200240, China, Shanghai, Minhang District,,,
803,IBM Cloud, Canada, ON,Toronto,,,,
804,uNetworks, Germany, 90429 Nürnberg,Fürther Straße 212,,,3649.0,
805,Leuk Teleport and Data Centre, Switzerland, Leuk,Brentjong 2,,,,4.0
806,LCL Belgium, Belgium, Antwerp,Noorderlaan 133,,,,
807,EdgeConnex, USA, CA, Santa Clara,1700 Richard Avenue,19800.0,,1.8
808,EdgeConnex, USA, TN 38115, Memphis,4005 S Mendenhall Rd #6,16700.0,,1.5
809,STACK INFRASTRUCTURE, Australia, Hume ACT,56 Sheppard Street,,,,28.0
810,Oracle, Canada, QC,Montreal,,,,
811,Amazon AWS, China, Beijing, Shunyi District,Yanshun Road,,,
812,Epsilon Telecommunications, UK, London, 69-77 Paul Street,Telephone House,5500.0,,
813,Netforchoice Data Center, India, Uttar Pradesh, Noida, Sector 57,,,
814,STACK EMEA, Denmark, Taastrup, Litauen Alle,Copenhagen Markets,17222.0,,1.5
815,Redcentric, United Kingdom, Hounslow TW4 6NW, Cranford,Green Lane,195000.0,130000.0,
816,Aventus Data Centers, USA, WI, Marshfield,901 Commerce Drive,20000.0,,
817,Aptum Technologies, United Kingdom, Hampshire PO9 1SA, Havant, Langstone Road,58000.0,10000.0,10.0
818,NewTelco, Ukraine, Kyiv Oblast, Plesets'ke, 50,,1184.0,
819,ColoBarn, USA, FL, Malabar,3225 Jordan Boulevard,60000.0,4000.0,
820,Amazon AWS, USA, OR 97818, Boardman,Rippee Road,,,
821,Pulsant, UK, Milton Keynes MK14 6PD, Linford Wood,Rockingham Drive,21818.0,12013.0,2.1
822,Epsilon Telecommunications, South Korea, Seoul, Guro-gu,61 Digital-ro 31-gil,249131.0,,
823,EvoSwitch, Singapore,1 Serangoon North Ave 6,,,153000.0,,5.0
824,Dorabase, Turkey, 34722 Kadıköy/İstanbul, Eylül Sokak No:12,Eğitim,11302.0,,
825,MedOne, Israel,Petach Tikva,,,,21528.0,3.5
826,uNetworks, Germany, 33602 Bielefeld,Niederwall 2,,,3218.0,
827,Aventus Data Centers, USA, WI, Milwaukee,7901 West Clinton Avenue,26432.0,,
828,Mosaic Data Services, USA, VA,Ashburn,,,,
829,EdgeConnex, USA, CO, Englewood,8451 Highfield Parkway,115500.0,,21.6
830,EXA Infrastructure, UK, Bracknell RG12 8TH, Oldbury,St James House,3229.17,,1.0
831,WowRack, USA, WA, Tukwila,12201 Tukwila International Boulevard,,18000.0,3.0
832,EdgeConnex, USA, WA 98168, Seattle,3425 South 116th Street building 6 suite 133,47000.0,,4.5
833,Leading Edge Data Centres, Australia,Dubbo NSW,,,6243.0,,0.75
834,MDC Data Centers, USA, AZ, Nogales,81 North Sonoita Avenue,,,0.2
835,Colt Technologies, Germany, Hamburg,Drehbahn 1,,26910.0,,
836,EvoSwitch, UK, Slough SL1 2JH,4 Slough Road,,53820.0,,
837,910Telecom, USA, Colorado, Denver,910 15th Street,140000.0,,2.0
838,Global Switch, Hong Kong, New Territories, Tseung Kwan O Industrial Estate,18 Chun Yat Street,758361.0,,100.0
839,IBM Cloud, Brazil, State of São Paulo,São Paulo,,,,
840,Prime Data Centers, USA, CA 95652, McClellan Park,2407 Ak St,65000.0,39711.0,8.0
841,Digital Realty, USA, NJ, Piscataway Township,3 Corporate Place,277000.0,135000.0,26.0
842,Equinix, Finland, Helsinki,Sahamyllyntie 4b,,8934.0,8934.0,2400.0
843,FIBERTOWN, USA, TX, Houston,12031 North Freeway,10000.0,,6.0
844,Iron Mountain Data Centers, Germany, 60437 Frankfurt am Main,Heinrich-Lanz-Allee 47,,414410.0,,10.6
845,Digital Realty, Germany, 65936 Frankfurt am Main,Wilhelm-Fay-Straße 24,,75000.0,,9.0
846,HostDime, Mexico, Jalisco, 44510 Zapopan, Jardines Plaza del Sol,20000.0,,
847,Atlantic.net, USA, FL, Orlando,440 West Kennedy Boulevard,,,
848,UnitedLayer, USA, CA, San Francisco,200 Paul Avenue,512642.0,32000.0,
849,Equinix, USA, FL, Doral,1525 Northwest 98th Court,108336.0,75043.0,
850,antage Data Centers, Germany, Offenbach am Main, Goethering 27,Vantage Data center - FRA11,452000.0,,56.0
851,Rackspace, USA, NJ, Franklin Township,202-216 Campus Drive,35000.0,,2.4
852,Hivelocity, USA, CA, Los Angeles,624 South Grand Avenue,,,
853,Digital Realty, USA, CA, El Segundo,2260 E El Segundo Blvd,132240.0,68000.0,18.0
854,Equinix, USA, VA, Culpeper,18155 Technology Drive,105980.0,62393.0,11.25
855,Zenlayer, Singapore 139964, Blk 20 Ayer Rajah Crescent,Ayer Rajah Crescent,,,,
856,CyrusOne, USA, NJ, Totowa,50 Madison Road,200000.0,50000.0,16.0
857,Digital Realty, USA, NY, New York,60 Hudson Street,164000.0,,
858,Digital Realty, USA, AZ, Phoenix,120 East Van Buren Street,347000.0,175000.0,32.3
859,Lumen, USA, TX, Dallas,3180 Irving Blvd,80000.0,46070.0,12.0
860,Digital Realty, Netherlands, Amsterdam,Science Park Amsterdam 121,,,,
861,Cirion Technologies, Chile, Huechuraba,Condominio Santa María de Huechuraba 6951,,8000.0,7000.0,4.0
862,Digital Realty, UK, London,11 Hanbury Street,,58125.0,,16.0
863,antage Data Centers, Canada, QC, Pointe-Claire,2800 Trans-Canada Highway,320000.0,,48.0
864,Iron Mountain Data Centers, USA, IL, Des Plaines,1680 Touhy Avenue,315000.0,,36.0
865,Digital Realty, Germany, 60386 Frankfurt am Main,Hanauer Landstraße 360/building 2,,87000.0,,16.2
866,Zenlayer, UK, London E1 6QL,91-95 Brick Lane,,,,
867,Equinix, UK, Manchester, Stretford, 76 Trafford Wharf Road,46500.0,32292.0,3.5
868,Digital Realty, USA, VA 20147, Ashburn,44372 Round Table Plaza bldg m,223200.0,,
869,QTS Data Centers, USA, FL, Miami,11234 Northwest 20th Street,38000.0,20000.0,2.0
870,Cascade Divide Data Centers, USA, OR, Bend,207 Southwest Columbia Street,,,
871,Centersquare, USA, MA, Waltham,580 Winter Street,165968.0,107570.0,16.0
872,Hivelocity, USA, NY, Staten Island,7 Teleport Drive,,,
873,Digital Realty, Belgium, Zaventem,Wezembeekstraat 2,,111945.0,53819.0,7.2
874,Digital Realty, Germany, Frankfurt,Hanauer Landstraße 302,,,,
875,CyrusOne, USA, VA, Sterling,21350 Pacific Blvd,90000.0,,105.0
876,DataBank, USA, TX, Richardson,904 Quality Way,68000.0,41320.0,5.7
877,Equinix, Germany, 60388 Frankfurt am Main,Friesstraße 22,,64368.0,,18.0
878,Flexential, USA, Georgia 30122, Douglasville,1750 N River Rd,358000.0,,36.0
879,Digital Realty, Ireland, Dublin, Cherry Orchard,24 Hume Avenue,2400.0,2400.0,
880,Digital Realty, Singapore, 29A International Business Park,International Business Park Road,,377000.0,,26.0
881,Equinix, Netherlands, Amsterdam,Science Park 610,,191597.0,68889.0,18.0
882,Telehouse, USA, NY, Staten Island,7 Teleport Drive,162000.0,80000.0,10.0
883,China Telecom, China, Beijing Shi, Daxing Qu,Dr. Peng Group (Tongji Middle Road),,,
884,Centersquare, USA, VA, Ashburn,21571 Beaumeade Cir,164453.0,96644.0,10.0
885,Equinix, USA, GA, Atlanta,180 Peachtree Street Northwest,79200.0,43012.0,4.5
886,Iron Mountain Data Centers, Germany, 60388 Frankfurt,Borsigallee 1,,280000.0,,27.0
887,Singtel, Singapore,375 Tanjong Katong Road,,,,,
888,Equinix, Türkiye, Dudullu Osb/Ümraniye/İstanbul, 3. Caddesi No:4,Yukarı Dudullu,277170.0,16146.0,21.0
889,Centersquare, USA, AZ, Mesa,1301 West University Drive,154158.0,73500.0,14.0
890,Equinix, USA, CA, Sunnyvale,255 Caspian Drive,120000.0,67622.0,8.0
891,Equinix, Netherlands, Amsterdam,Luttenbergweg 4,,96681.0,29062.0,9.54
892,Centersquare, USA, NJ, Weehawken,300 J F Kennedy Boulevard East,802397.0,802397.0,105.6
893,antage Data Centers, UK, Newport, Duffryn, Coedkernew,2000000.0,,148.0
894,Equinix, USA, CA, San Jose,9 Great Oaks Boulevard,175311.0,93498.0,15.0
895,Deft, Heiwajima6 Chome−5−1 東京流通センター物流ビルＣ棟, Ota City, Tokyo,Japan,37663.0,21087.0,
896,TierPoint, USA, PA, Norristown,1000 Adams Avenue,137000.0,61000.0,
897,Equinix, USA, VA, Vienna,7990 Science Applications Court,44382.0,27356.0,2.2
898,Equinix, USA, NJ, Carteret,1400 Federal Boulevard,113944.0,91413.0,
899,Telefonica Global Solutions, Spain, 28805 Alcala de Henares, 23,Av. Punto Com,265000.0,100000.0,15.0
900,Equinix, Portugal, 2685-378 Prior Velho,Avenida Severiano Falcão 14,,56995.0,16005.0,
901,Singtel, Singapore,7 Bedok South Road,,,,,
902,Equinix, USA, CA, San Jose,11 Great Oaks Boulevard,133500.0,82851.0,4.0
903,Equinix, USA, CA, El Segundo,445 North Douglas Street,177469.0,62159.0,0.5
904,antage Data Centers, Germany, 15749 Mittenwalde,Dahmestraße 1,,260000.0,,32.0
905,CyrusOne, USA, TX, Carrollton,1649 West Frankford Road,670000.0,400000.0,90.0
906,Equinix, UK, Slough,13 Liverpool Road,,110566.0,74873.0,9.6
907,CyrusOne, USA, CT, Norwalk,6 Norden Place,168000.0,75000.0,16.0
908,Equinix, Hong Kong, Tseung Kwan O Industrial Estate,299 Wan Po Road,,367981.0,8332.0,8.0
909,Cologix, Canada, QC, Drummondville,2525 Rue Canadien,120000.0,50000.0,10.0
910,Equinix, USA, TX, Dallas,1950 North Stemmons Freeway,61573.0,30355.0,3.0
911,Amanah Tech Inc., Canada, ON, Toronto,1 Yonge Street,760000.0,4000.0,1.0
912,Web Werks India Pvt Ltd, India, Maharashtra, Navi Mumbai, Rabale,82000.0,,6.3
913,Equinix, Brazil, Barueri - State of São Paulo, 3641 - Tamboré,Alameda Araguaia,95387.0,34432.0,12.0
914,SBA Edge, USA, IL, West Chicago,603 Discovery Drive,80000.0,60000.0,4.0
915,Equinix, Australia, Shenton Park WA 6008,1/37 Lemnos Street,,34051.8,,
916,Equinix, Sweden, Bromma,Mariehällsvägen 36,,38254.0,38254.0,
917,Equinix, Germany, Frankfurt,Gutleutstraße 310,,107639.0,74152.0,11.52
918,antage Data Centers, USA, AZ, Goodyear,45 South Bullard Avenue,800000.0,800000.0,32.0
919,China Telecom, China, Shanghai, Baoshan Qu, Hulan Road,,,
920,365 Data Centers, USA, IL, Chicago,427 South LaSalle Street,10000.0,,1.72
921,Element Critical, USA, VA, Vienna,7990 Quantum Drive,200000.0,70000.0,10.0
922,Digital Realty, Germany,40599 Düsseldorf,,,47000.0,,23.0
923,Deft, UK,London,,,,,
924,Iron Mountain Data Centers, USA, CO, Denver,4300 Brighton Blvd,180000.0,,14.4
925,Equinix, France, Pantin, 110 bis Avenue du Général Leclerc,Dachser Paris Pantin,98737.0,54358.0,
926,Digital Realty, Ireland, Dublin, Kilcarbery,2 Profile Park,86111.0,,5.0
927,DataBank, USA, IL, Chicago,840 South Canal Street,14500.0,11470.0,2.0
928,Centersquare, USA, CO, Englewood,8534 Concord Center Drive,98218.0,98218.0,7.2
929,DataBank, USA, TX, Waco,700 Austin Avenue,34000.0,14210.0,0.8
930,DataBank, USA, CA 92128, San Diego,12270 World Trade Drive suite 100,88000.0,55140.0,3.2
931,Cogent Communications, USA, FL, Doral,3701 Northwest 82nd Avenue,9760.0,9760.0,
932,China Telecom, China, Hubei, Wuhan, Hongshan,,,
933,Aureon, USA, IA, Des Moines,616 10th Street,30000.0,1500.0,1.0
934,365 Data Centers, USA, MI, Southfield,24660 Lahser Road,12000.0,,0.8
935,TierPoint, USA, PA, Breinigsville,9999 Hamilton Boulevard,122000.0,58300.0,25.0
936,China Telecom, Singapore, Woodlands,Woodlands Street 12,,,,
937,DataBank, USA, GA 30336, Atlanta,200 Selig Dr SW,,156780.0,40.0
938,Centersquare, USA, VA, Sterling,45901 Nokes Boulevard,556457.0,556457.0,47.0
939,Digital Realty, France, Paris,45 Avenue Victor Hugo,,16000.0,,2.0
940,Equinix, Switzerland, Zürich,Josefstrasse 225,,4015.0,4015.0,
941,Digital Realty, Germany, HE, 60528 Frankfurt, Lyoner Straße 28,39000.0,,3.9
942,MOD Mission Critical, USA, GA, Atlanta,250 Williams Street Northwest,,33000.0,
943,Struxture, Canada, ON, Barrie,612 Welham Road,60000.0,,10.0
944,365 Data Centers, USA, CA, Rancho Cordova,11085 Sun Center Drive,69048.0,30248.0,5.0
945,Digital Realty, USA, TX, Austin,7500 Metro Center Drive,85688.0,,16.0
946,Equinix, Ireland, Dublin,Blanchardstown,,189951.0,,
947,Hut 8, Canada, ON,Mississauga,,29000.0,6420.0,3.5
948,Cologix, Canada, ON, Toronto,151 Front Street West,25000.0,25000.0,
949,Lumen, USA, IL, Chicago,900 North Kingsbury Street,182016.0,10840.0,8.5
950,Lumen, USA, FL, Tampa,7909 Woodland Center Boulevard,53168.0,4795.0,9.6
951,Telehouse, Türkiye, Kadıköy/İstanbul, Saniye Ermutlu Sokak No:10,Kozyatağı,41656.0,41656.0,
952,CoreSite, USA, CO, Denver,910 15th Street,29000.0,,
953,365 Data Centers, USA, New York, NY,65 Broadway,,16583.0,0.7
954,Atlantic.net, Canada, Ontario, Scarborough,20 Pullman Ct,,,
955,Dynascale, USA, CA, Irvine,2640 Main Street,20000.0,,
956,Hivelocity, USA, TX, Dallas,1515 Round Table Drive,685000.0,685000.0,
957,Lumen, USA, TX, Houston,12001 North Freeway,51300.0,14816.0,
958,FirstLight, USA, NH, Portsmouth,359 Corporate Drive,8700.0,,
959,Centersquare, USA, WA, Tukwila,12301 Tukwila International Boulevard,112942.0,112942.0,7.5
960,Colocation America, USA, CA, Los Angeles,530 W 6th St,,,
961,Digital Realty, Greece, Κορωπί 194 00,Varis Koropiou Avenue 76,,12000,,1.225
962,China Telecom, China, Shanghai,Baoshan,,,,
963,China Telecom, 潮枫路, Xiangqiao, Chaozhou, Guangdong,,,
964,China Telecom, China, Sichuan Sheng, Chengdu Shi, Wuhou Qu,,,
965,Zenlayer, Ukraine, Dnipropetrovsk Oblast, Dnipro, 7,,,
966,Tel Networks Inc., USA, NY, Albany,194 Washington Avenue,,,
967,China Telecom, China, Shanghai Shi, Xuhui Qu, Guiqing Road,,,
968,Equinix, Chile, San Antonio,Ruta 66,,11528,,
969,China Telecom, China, Guangdong, Guangzhou,Huangpu,,,
970,PhoenixNAP, Netherlands,Amsterdam,,,12000,,25.0
971,China Telecom, USA, NY 12590, Wappingers Falls,155 Myers Corners Rd,,,
972,China Telecom, China, Shanghai, Pudong,60 Huajing Rd,,,
973,China Telecom, China, Guangxi Zhuangzuzizhiqu, Nanning Shi, Jiangnan Qu,,,
974,China Telecom, China, Guangdong Sheng, Foshan Shi, Nanhai Qu,,,
975,Tel Networks Inc., USA, NY, New York,111 8th Avenue,,,
976,China Telecom, China, Guangdong,Foshan,,,,
977,Enzu, USA, TX, Houston,660 Greens Parkway,,,
978,China Telecom, China, Hubei, Xiantao,Hanjiang Rd,,,
979,Hivelocity, South Africa, Johannesburg, Isando,5 Brewery Street,,,
980,China Telecom, China, Hubei, Huanggang, Huangzhou,,,
981,Green Colo LTD, UK, Fareham, Portchester,Walled Garden,"5,000","2,500",1.5
982,China Telecom, China, Shanghai, Huangpu Qu, Zhongshan South Road,,,
983,Telehouse, China, Shanghai, Pudong,400 Fangchun Road,,36167,
984,China Telecom, South Korea,Seoul,,,,,
985,China Telecom, China, Shanghai,Pudong,,,,
986,China Telecom, USA, CA 90245, El Segundo,445 North Douglas Street,,,
987,China Telecom, China, Guangdong Sheng, Shenzhen Shi, Nanshan Qu,,,
988,China Telecom, China, Shanghai,Putuo,,,,
989,China Telecom, China, Jiangsu Sheng, Changzhou Shi,Jintan Qu,,,
990,MOD Mission Critical, USA, NC, Raleigh,5301 Departure Drive,40000,36000,2.0
991,China Telecom, China, Jiangsu, Suzhou, Wuzhong District,,,
992,Enzu, USA, CA, Santa Clara,2151 Mission College Boulevard,,,
993,"Ascenty, a Digital Realty Company", Brazil, Hortolândia - State of São Paulo, 4 - Jardim Santa Izabel,Rua Papa João Paulo II,43055.64,,7.0
994,China Telecom, China, Jiangsu, Suzhou,Taicang,,,
995,China Telecom, China, Shanghai Shi, Pudong Xinqu, Lu Jia Zui,,,
996,Colocation America, USA, NY, New York,111 8th Avenue,3000000,104814,
997,China Telecom, China, Guangdong, Jieyang,Rongcheng,,,
998,China Telecom, China, Jiangsu Sheng, Nantong Shi, Chongchuan Qu,,,
999,China Telecom, China, Jiangsu, Nanjing,Qinhuai,,,
1000,Digital Realty, USA, TX 75081, Richardson,907 Security Row,138500.0,,12.75
1001,Cogent Communications, USA, CA, Anaheim,300 S Harbor Blvd,1169.0,1169.0,
1002,Lumen, USA, CA, Fresno,305 W Napa Ave,30000.0,9900.0,
1003,Centersquare, USA, FL, Tampa,9310 Florida Palm Drive,96000.0,96000.0,9.6
1004,Lumen, USA, PA, Pittsburgh,143 South 25th Street,3661.0,1208.0,
1005,"Cato Digital, Inc", USA, VA 20166, Sterling,45901 Nokes Blvd,,,
1006,Whitelabel IT Solutions, USA, NJ, Hackensack,159 Atlantic Street,20000.0,12000.0,2.0
1007,Centersquare, USA, TN, Gallatin,1398 Gateway Drive,900000.0,,100.0
1008,CyrusOne, USA, IA, Council Bluffs,4700 Gifford Road,216000.0,120000.0,18.0
1009,Cologix, USA, CA, Santa Clara,2050 Martin Avenue,84000.0,,20.0
1010,Expedient, USA, OH, Upper Arlington,5000 Arlington Centre Boulevard,21591.0,9300.0,1.6
1011,Struxture, Canada, BC, Vancouver,555 West Hastings Street,54000.0,35000.0,2.14
1012,Equinix, China, Shanghai, Pudong,400 Fangchun Road,4539.0,4388.0,
1013,Digital Realty, USA, CA 95054, Santa Clara,1500 Space Park Drive,52000.0,,9.0
1014,Digital Realty, Germany, 40599 Düsseldorf,In der Steele 39/45,,26000.0,,109.0
1015,Iron Mountain Data Centers, India, Karnataka, Bengaluru, Whitefield,80000.0,,4.0
1016,DataBank, USA, NY, New York,60 Hudson Street,1000000.0,23940.0,0.74
1017,Lumen, USA, IN, Indianapolis,1902 South East Street,20000.0,1740.0,
1018,"Ascenty, a Digital Realty Company", Brazil, Osasco - State of São Paulo, 350 - Vila Menck,Av. Roberto Pinto Sobrinho,43055.64,,4.0
1019,China Telecom, China, Jiangsu, Nanjing,Pukou,,,
1020,H5 Data Centers, USA, AZ, Chandler,2600 West Germann Road,180000.0,145000.0,26.0
1021,NorthC, Netherlands, 3433 PC Nieuwegein,Frieslandhaven 6,,86111.0,44132.0,2.5
1022,Cologix, USA, FL, Lakeland,2850 Interstate Drive,105000.0,105000.0,
1023,Civicos Networking, France, Roubaix,1 Rue d'Orchies,,100.0,60.0,0.8
1024,CyberNest, Germany, Innenstadt I, 60327 Frankfurt,Gutleutstraße 310,,,
1025,Lunavi, USA, WY, Cheyenne,340 Progress Circle,,,5.0
1026,Evocative, USA, WA 98109, Seattle,140 4th Avenue North,40000.0,,4.5
1027,Direct LTx, USA, PA, Reading,2561 Bernville Road,300000.0,110000.0,6.0
1028,DC BLOX, USA, SC, Greenville,33 Global Drive,54000.0,,3.0
1029,Lumen, USA, CA, Tustin,14452 Franklin Avenue,53000.0,12294.0,
1030,Lumen, USA, TX, Austin,4207 Smith School Road,75474.0,3316.0,
1031,Zenlayer, Taiwan 220, New Taipei City, Banqiao District, Guoqing Road,,,
1032,bigbyte.cc, USA, NM, Albuquerque,123 Central Avenue Northwest,62000.0,15000.0,3.0
1033,Equinix, Japan, Chiba, Inzai,Izumino,186000.0,27577.0,
1034,Telehouse, United Kingdom, London E14 2AA,Coriander Avenue,,790071.0,790071.0,
1035,China Telecom, China, Jiangsu, Suzhou, Zhangjiagang,,,
1036,CoreSite, USA, CA, Milpitas,1656 McCarthy Boulevard,76000.0,,
1037,MOD Mission Critical, Netherlands, Noord-Holland, 1096 AM Amsterdam,H.J.E. Wenckebachweg 127,,,
1038,Cologix, USA, OH, Columbus,535 Scherers Court,11000.0,11000.0,
1039,Hivelocity, USA, IL, Chicago,350 East Cermak Road,1100000.0,,100.0
1040,Lumen, USA, CA, San Luis Obispo,775 Capitolio Way,35000.0,6200.0,
1041,Digital Realty, USA, IL, Northlake,505 North Railroad Avenue,251000.0,,40.0
1042,CoreSite, USA, CA, Los Angeles,200 Bauchet Street,150000.0,,
1043,DartPoints, USA, NC, Asheville,100 Technology Dr ste c,23000.0,11200.0,
1044,Enzu, Netherlands, Amsterdam,Science Park Amsterdam 610,,,,
1045,Telesystem, USA, MI, Monroe,1240 Huber Drive,8800.0,3600.0,
1046,Zenlayer, Hong Kong, Tseung Kwan O Industrial Estate,3 Chun Cheong Street,,,,
1047,"Daun Penh Data Center Co., Ltd (DPDC)", Cambodia, Phnom Penh,Hun Sen Boulevard,,7965.0,1044.0,
1048,FIBERTOWN, USA, TX, Bryan,110 N Main St,47000.0,25000.0,0.3
1049,Digital Realty, USA, NY 10013, New York, 6th Avenue,132500.0,132500.0,9.5
1050,Neutron Colocation, USA, ID, Coeur d'Alene,600 West Appleway Avenue,6000.0,3000.0,
1051,CoreSite, USA, GA, Marietta,1130 Powers Ferry Place,73000.0,,
1052,Lumen, USA, TX, Dallas,1150 Regal Row,10000.0,1900.0,
1053,Limestone Networks, USA, TX, Dallas,400 S Akard St,,,7.0
1054,Digital Fortress, USA, WA, Seattle,3101 Western Avenue,24000.0,,3.0
1055,Nxtra by Airtel, India, Karnataka, Bengaluru,Whitefield,,,5.5
1056,Hut 8, Canada, BC,Vancouver,,6210.0,4155.0,1.0
1057,Data Canopy, USA, TX 75013, Allen,2300 Chelsea Boulevard,976000.0,580000.0,50.0
1058,CyrusOne, USA, TX, San Antonio,9554 Westover Hills Boulevard,372000.0,196000.0,36.0
1059,DEAC European Data Center Operator, Vācija, Frankfurte,Gutleutstraße,,,,
1060,Lumen, USA, TX, Austin,2916 Montopolis Dr,11562.0,2298.0,
1061,Cogent Communications, USA, MA, Somerville,59 Inner Belt Road,12000.0,12000.0,
1062,DC BLOX, USA, AL, Huntsville,333 Diamond Drive Northwest,9000.0,,1.5
1063,atNorth, Sweden, Kista,Esbogatan 4,,,64583.0,10.5
1064,DataBank, USA, UT 84111, Salt Lake City,179 Social Hall Ave,16000.0,10610.0,0.5
1065,NorthC, Switzerland, 4142 Münchenstein,Weidenstrasse 41,,37674.0,23681.0,6.0
1066,Struxture, Canada, QC, Montreal,1080 Beaver Hall Hill,7500.0,,5.0
1067,Lumen, USA, AZ, Phoenix,17 East Virginia Avenue,5000.0,2800.0,
