,name,country,city,town,address,total space (sqft),colocation space (sqft),total power (MW)
1439,Amazon AWS, Ireland, Dublin,Dublin Industrial Estate,,,,
1440,365 Data Centers, USA, NJ, Bridgewater,999 Frontier Road,,25600.0,2.3
1441,Centersquare, USA, VA, Sterling,22860 International Drive,556457.0,556457.0,47.0
1442,Equinix, Australia, Mascot NSW,639 Gardeners Road,,24027.0,17068.0,8.1
1443,Element Critical, USA, TX, Katy,22000 Franz Road,118248.0,73184.0,26.0
1444,Hut 8, Canada, BC,Kelowna,,30000.0,15000.0,6.0
1445,Digital Realty, USA, CT, Trumbull,80 Merritt Boulevard,228000.0,,15.0
1446,H5 Data Centers, USA, MO, St. Louis,710 N Tucker Blvd,550000.0,36000.0,
1447,UnitedLayer, USA, CA, Los Angeles,624 South Grand Avenue,,664248.0,2.0
1448,Equinix, USA, VA, Ashburn,21551 Beaumeade Circle,152392.0,84829.0,
1449,Flexential, USA, AZ 85027, Phoenix,1850 W Deer Valley Rd,109476.0,42500.0,5.02
1450,Centersquare, USA, OH, Lewis Center,8180 Green Meadows Dr,27000.0,27000.0,7.5
1451,DSM, USA, FL, Winter Haven,200 Avenue B Northwest,33000.0,33000.0,
1452,Switch Data Centers, USA, TX, Austin,7401 East Ben White Boulevard,,,
1453,Iron Mountain Data Centers, United Kingdom, Slough SL1, Windsor,4 Slough Road,112000.0,,8.7
1454,Zenlayer, India, Tamil Nadu, Siruseri, near Chennai,,,
1455,Iron Mountain Data Centers, USA, AZ, Scottsdale,8521 East Princess Drive,121000.0,,5.8
1456,Centersquare, Canada, ON, Mississauga,6800 Millcreek Drive,185000.0,185000.0,12.0
1457,CyrusOne, Netherlands, 1165 Haarlemmerliede,Linieweg 1,,315920.0,,54.0
1458,Quest Technology Management, USA, CA, Roseville,9000 Foothills Boulevard,,,
1459,DataBank, USA, MN, Brooklyn Park,8111 Oxbow Creek Drive North,86000.0,48980.0,9.0
1460,Lumen, USA, TX, Austin,500 Chicon Street,5000.0,986.0,
1461,CyrusOne, Germany, Hanau,Industrieweg 45,,193750.0,,54.0
1462,CoreSite, USA, MA, Somerville,70 Inner Belt Road,253000.0,,
1463,Equinix, Finland, Helsinki,Parrukatu 2,,13670.0,13670.0,2304.0
1464,China Telecom, China, Guangdong, Shenzhen, Longgang,,,
1465,Digital Realty, Spain, 28037 Madrid, 4,Calle de Alfonso Gómez,380000.0,,30.0
1466,Psychz Networks, USA, TX, Dallas,1515 Round Table Drive,60000.0,,
1467,Switch Data Centers, USA, MI, Caledonia, 6100 East Paris Avenue South East,660000.0,,
1468,Cirion Technologies, México, CDMX, 11529 Ciudad de México, Granada,,,2.0
1469,CoreSite, USA, DC, Washington, Downtown,24000.0,,
1470,Zenlayer, Taiwan 114, Taipei City, Neihu District, Ruiguang Road,,,
1471,365 Data Centers, USA, GA, Alpharetta,11650 Great Oaks Way,77300.0,45000.0,4.3
1472,Flexential, USA, GA 30071, Norcross,2775 Northwoods Pkwy,32740.0,10000.0,2.21
1473,Equinix, Germany, Frankfurt,Taubenstraße 7-9,,30720.0,18546.0,1800.0
1474,Equinix, USA, CA, Los Angeles,600 West 7th Street,125479.0,60718.0,2.3
1475,"Ascenty, a Digital Realty Company", Brazil, 02675-031, Osasco - SP, 306-744 - Vila Menck,96875.19,,14.0
1476,Equinix, United Kingdom, Slough SL1 4QZ,13 Liverpool Road,,387500.0,,
1477,Lumen, USA, TX, Fort Worth,1601 Jones Street,18686.0,6300.0,
1478,Tel Networks Inc., Canada, AB, Edmonton,10032 103 St NW,,,
1479,Equinix, Poland, Warsaw,Poleczki 23,,12916.0,10463.0,
1480,Equinix, USA, CA, Torrance,1501 Francisco Street,108336,74983,12000.0
1481,CoreSite, USA, IL, Chicago,1432 South Clinton Street,169000,,
1482,Rackspace, USA, NJ, Somerset,125 Belmont Drive,56000,11000,1.2
1483,QuadraNet, USA, FL, Miami,36 Northeast 2nd Street,162140,,2.0
1484,Hivelocity, USA, CA, Los Angeles,600 West 7th Street suite 510,,,
1485,CyrusOne, USA, OH, Cincinnati,229 West 7th Street,400000,212000,12.0
1486,Equinix, USA, WA, Seattle,2001 6th Avenue,43610,36382,2.1
1487,Equinix, Switzerland, Geneva,Rue de la Confédération 6,,35520,22174,1.8
1488,Equinix, Japan, Tokyo, Ōta,6-5-1 Heiwajima,38906,22733,5.4
1489,Equinix, Sweden, Spånga,Finspångsgatan 48,,37856,37856,5018.0
1490,DC2Scale, France, 78140 Vélizy-Villacoublay, Rue des Frères Caudron,Inovel Parc,2960,300,0.3
1491,rne Global, Finland, 01260 Vantaa,Mittalinja 1,,204514,,25.0
1492,Sabey Data Centers, USA, VA 20147, Ashburn,21741 Red Rum Dr,,,36.0
1493,Involta, USA, PA, Freeport,161 Armstrong Drive,39000,11200,1.5
1494,S3 Company Ltd., Bulgaria, Sofia,"Boulevard ""Shipchenski Prohod"" 63",,,,0.2
1495,Centersquare, USA, TX, Fort Worth,14901 FAA Boulevard,373700,373700,20.0
1496,atNorth, Finland, Espoo,Sinimäentie,,247500,23600,11.2
1497,Evocative, USA, GA, Atlanta,250 Williams Street Northwest,36000,17000,15.0
1498,Equinix, United Kingdom, Slough SL1 4JW,765 Henley Road,,11399,,
1499,Equinix, USA, GA, Atlanta,56 Marietta Street NorthWest,14003,6479,0.9
1500,Equinix, Canada, AB T2E 6J8, Calgary,1930 Maynard Rd SE unit 22,73000,,
1501,Iron Mountain Data Centers, USA, VA, Manassas,11660 Hayden Road,221500,,36.0
1502,Evocative, USA, TX, Plano,2800 Summit Avenue,300000,,30.0
1503,QTS Data Centers, USA, Kansas 66213, Overland Park,12851 Foster Street,33000,2500,0.18
1504,Equinix, Germany, Düsseldorf,Albertstraße 27,,58738,34445,4.2
1505,Aligned Data Centers, USA, TX, Plano,2800 Summit Ave,375000,52700,60.0
1506,Liquid Web, USA, Arizona 85034, Phoenix,3402 E University Dr,,,40.0
1507,Digital Realty, France, Saint-Denis,7-9 Avenue Arts et Métiers,,22000,,7.0
1508,Hivelocity, Germany, 60314 Frankfurt am Main,Hanauer Landstraße 322,,,,
1509,Digital Realty, Nigeria, Abuja,23 Kolda St,,242782,,2.7
1510,TRG Datacenters, USA, TX, Houston,2626 Spring Cypress Road,150000,150000,5.2
1511,Cirion Technologies, Argentina, Buenos Aires,Av. del Campo 1301,,30138,21527,6.4
1512,Lumen, USA, NJ, Weehawken,300 Boulevard East,38017,7442,
1513,Equinix, Poland, Warsaw,Aleje Jerozolimskie 65/79,,9978,9978,
1514,Equinix, Spain, 41007 Seville, 36-48,Avenida de Montes Sierra,9440,3444,
1515,Digital Realty, USA, VA 20147, Ashburn,44060 Digital Loudoun Plaza bldg k,392711,,44.0
1516,Digital Realty, USA, TX, Richardson,1232 Alma Road,105726,,12.0
1517,Bluebird Data Centers, USA, IA, Bettendorf,2701 Devils Glen Road,"53,000","32,000",4.0
1518,China Telecom, China, Shanghai Shi,Pudong,,,,
1519,365 Data Centers, USA, NY, Commack,500 Commack Road,26200,,6.0
1520,Equinix,Khazna Data Centre AUD - Masdar City - Abu Dhabi - United Arab Emirates,,,,1679.0,1679.0,1.6
1521,Equinix, Australia, Mascot NSW,639 Gardeners Road,,52571.0,33234.0,7.2
1522,Telefonica Global Solutions,11300 Northwest 25th Street,,,,173500.0,44000.0,12.0
1523,Equinix, USA, NJ, Secaucus,275 Hartz Way,183900.0,131037.0,6.8
1524,Equinix, Australia, Alexandria NSW,200 Bourke Road,,661722.2,60870.0,
1525,Equinix, Hong Kong, Tsuen Wan,3 Shing Yiu St,,322578.0,87509.0,13.5
1526,Equinix, Ireland, County Dublin, Ballycoolen,Northwest Business Park,113580.0,51322.0,10.08
1527,Digital Realty, USA, TX, Carrollton,4025 Midway Road,100590.0,100000.0,10.0
1528,Equinix, Australia, Alexandria NSW,200 Bourke Road,,163073.0,80140.0,
1529,China Telecom, China, Inner Mongolia, Hohhot,Horinger,,,
1530,Equinix, Singapore,15 Pioneer Walk,,,363302.0,219263.0,50.0
1531,Equinix, Australia, Silverwater NSW 2128,8-14 Egerton Street,,79520.0,24512.0,
1532,Equinix,Dubai Production City - Dubai - United Arab Emirates,,,,40906.0,40906.0,5.6
1533,Equinix, USA, NJ, Secaucus,800 Secaucus Road,275322.0,108005.0,10.0
1534,Equinix, UK, Slough,8 Buckingham Avenue,,226042.0,172222.0,2200.0
1535,antage Data Centers, Germany, Ludwigsfelde, Uferring 5,Brandenburg Park,474000.0,,56.0
1536,antage Data Centers, Canada, QC H4S 2C2, Saint-Laurent,2900 Avenue Marie Curie,60000.0,60000.0,11.0
1537,Equinix, USA, NY, New York,111 8th Avenue,55721.0,35894.0,1.7
1538,Singtel, Singapore,9 Tuas Avenue 3,,,,,
1539,SIfy Technologies Limited, India, West Bengal, Kolkata, Newtown,8900.0,8900.0,2.0
1540,Equinix, USA, VA, Ashburn,44470 Chilum Place,95444.0,67041.0,5.5
1541,Equinix, USA, CA, San Jose,1735 Lundy Avenue,103420.0,54488.0,4.6
1542,Iron Mountain Data Centers, USA, AZ, Phoenix,615 North 48th Street,588669.0,,41.0
1543,Equinix, Indonesia, West Java, Bekasi, Mekarwangi,65000.0,20021.0,
1544,antage Data Centers, Germany, Raunheim,Alexander-von Humboldt-Straße,,485000.0,,56.0
1545,Digital Realty, Netherlands, Schiphol-Rijk,Cessnalaan 50,,51666.0,7300.0,
1546,Equinix, Germany, Frankfurt,Lärchenstraße 110,,113021.0,91526.0,8.96
1547,Centersquare, USA, TX, Allen,900 Guardians Way,112292.0,77124.0,12.0
1548,PhoenixNAP, USA, AZ, Phoenix,3402 East University Drive,,90000.0,
1549,Equinix, Hong Kong, Tsuen Wan,168 Yeung Uk Rd,,281630.0,86909.0,4.0
1550,Equinix, USA, VA, Ashburn,21691 Filigree Court,99969.0,60587.0,6.8
1551,Equinix, UK, Slough SL1 4LH,1 Banbury Avenue,,135600.0,71042.0,
1552,Digital Realty, Netherlands, Rozenburg,Pudongweg 37,,143687.0,86111.0,15.0
1553,Rackspace, USA, TX, Richardson,1215 Integrity Drive,56179.0,,6.975
1554,Singtel, Singapore,7000 Ang Mo Kio Ave 5,,,,,
1555,Equinix, USA, VA, Ashburn,21721 Filigree Court,148659.0,59370.0,7.5
1556,NorthC, Netherlands, Oude Meer, Fokkerweg 300,Fokker Logistics Park,193750.0,66736.0,4.8
1557,Rackspace, UK, Slough,115 Buckingham Avenue,,65340.0,,10.26
1558,SIfy Technologies Limited, India, Tamil Nadu, Chennai, Taramani,1000000.0,10000.0,1.6
1559,Equinix, USA, IL, Chicago,350 East Cermak Road,143630.0,50992.0,6.0
1560,DataBank, USA, GA, Atlanta,1100 White Street Southwest,75000.0,52610.0,4.0
1561,DataBank, USA, IN, Indianapolis,650 West Henry Street,46000.0,31080.0,3.75
1562,Flexential, USA, CO, Aurora,11900 East Cornell Avenue,171000.0,171000.0,6.75
1563,Lunavi, USA, WA, Seattle,2001 6th Avenue,,,0.56
1564,China Telecom, Singapore, Singapore 139963,26A Ayer Rajah Crescent,,,,
1565,Digital Realty, Canada, ON M5J 2N1, Toronto,151 Front St,325772.0,,8.0
1566,Digital Realty, USA, CA, San Francisco,200 Paul Avenue,425000.0,121220.0,45.0
1567,Equinix, Switzerland, Le Lignon,Route du Bois-des-Frères 48,,48437.0,25295.0,
1568,NYI, USA, NY, New York,75 Broad St,22000.0,22000.0,2.0
1569,Digital Realty, Spain, 28037 Madrid, 49,Calle de Emilio Muñoz,93000.0,,5.8
1570,Telia Company, France, Villepinte,22 Avenue des Nations,,,,
1571,Lumen, USA, AL, Birmingham,2001 Park Place,3408.0,796.0,
1572,Equinix, Bulgaria, Plovdiv,"ulitsa ""Druzhba"" 1",,32291.0,20085.0,2.88
1573,Psychz Networks, Taiwan, Taipei City, Neihu District, Ruiguang Road,,,
1574,DataBank, USA, UT 84111, Salt Lake City,179 Social Hall Ave,16000.0,10610.0,0.5
1575,Zenlayer, Indonesia, Central Java 50263, Semarang, Srondol Kulon,,,
1576,Datalahti, Finland, Helsinki,Elimäenkatu 25-27,,18957.0,9687.0,0.8
1577,QTS Data Centers, USA, Virginia 20110, Manassas,9400 Godwin Court,123200.0,,
1578,Technology Solutions of SC Inc, USA, SC, Seneca, U.S. 123,6800.0,1400.0,1.0
1579,Flexential, USA, FL 32256, Jacksonville,4905 Belfort Road suite 145,35184.0,8500.0,1.39
1580,"Ascenty, a Digital Realty Company", Brazil, Jundiaí - State of São Paulo,Av. Beirute - Jardim Ermida I,,97000.0,,14.0
1581,Digital Realty, USA, CA, Santa Clara,2820 Northwestern Parkway,40000.0,40000.0,7.5
1582,DC BLOX, USA, AL, Huntsville,333 Diamond Drive Northwest,9000.0,,1.5
1583,DC BLOX, USA, TN, Chattanooga,807 East 16th Street,8000.0,7000.0,1.0
1584,DEAC European Data Center Operator, Vācija, Frankfurte,Gutleutstraße,,,,
1585,China Telecom, China, Hubei, Wuhan, Dongxihu,,,
1586,Struxture, Canada, QC, Montreal,1080 Beaver Hall Hill,7500.0,,5.0
1587,Digital Realty, USA, CA 95050, Santa Clara,641 Walsh Ave,430000.0,,100.0
1588,CyrusOne, USA, TX, San Antonio,9554 Westover Hills Boulevard,372000.0,196000.0,36.0
1589,Digital Realty, USA, CA, Oakland,720 2nd Street,122000.0,121220.0,14.5
1590,1547 Critical Systems Realty, USA, IL, Chicago,725 South Wells Street,66000.0,42000.0,5.0
1591,Digital Realty, France, 93120 La Courneuve,2 Avenue Marcel Cachin,,103000.0,,19.0
1592,Lumen, USA, TX, Austin,2916 Montopolis Dr,11562.0,2298.0,
1593,China Telecom, UK, London NW10 6PW, Volt Avenue,Powergate Business Park,,,
1594,China Telecom, USA, VA 20147, Ashburn,44790 Performance Circle,,,
1595,Iron Rails Data Centers, USA, NY 12207, Albany,575 Broadway,97000.0,14950.0,4.0
1596,bigbyte.cc, USA, NM, Albuquerque,123 Central Avenue Northwest,62000.0,15000.0,3.0
1597,Equinix, UK, Manchester, Lloyd Street North,Manchester Science Park,17964.0,17964.0,
1598,DC BLOX, USA, SC, Greenville,33 Global Drive,54000.0,,3.0
1599,Lumen, USA, CA, Fresno,305 W Napa Ave,30000.0,9900.0,
1600,uNetworks, Germany, 04129 Leipzig,Maximilianallee 2-4,,,5393.0,
1601,Cyberverse, USA, TX, Plano,2800 Summit Avenue,300000.0,,30.0
1602,Cyberverse, USA, AZ, Phoenix,2500 West Union Hills Drive,550000.0,,69.0
1603,"LDeX, an iomart company", UK, Manchester, Stretford, Trafford Park,20000.0,,1.5
1604,Amazon AWS, China, Beijing, Daxing District,Xinghai Road,,,
1605,HudsonIX, USA, NY, New York, Hudson Street,120000.0,,15.0
1606,Midwest Energy & Communications, USA, MI, Cassopolis,60590 Decatur Rd,,,
1607,LCL Belgium, Belgium, 9320 Aalst,Industrielaan 3A,,,,
1608,MadeIt, USA, OH,Columbus,,86000.0,,50.0
1609,MadeIt, Austria,Vienna,,,86000.0,,50.0
1610,myLoc a WIIT Company, Germany, West, 41189 Mönchengladbach,Dieselstraße 24-26,46436.0,4736.0,
1611,EdgeConnex, USA, TN 37210, Nashville,1841 Air Lane Drive bldg 3,42500.0,,3.0
1612,WowRack, Singapore,Singapore Island,,,,,
1613,"LDeX, an iomart company", United Kingdom, London NW2 7ET,2 Oxgate Lane,,22000.0,,2.0
1614,COPT Data Center, USA, VA, Manassas,9751 Hornbaker Road,200000.0,,
1615,Massive Networks, USA, CO, Louisville,382 South Arthur Avenue,,4800.0,
1616,LCL Belgium, Belgium, Diegem 1831 Machelen,Kouterveldstraat 13,,,,
1617,myLoc a WIIT Company, Germany, 67117 Limburgerhof,Rheingönheimer Weg 13,,,872.0,
1618,Epsilon Telecommunications, Hong Kong, Chai Wan,399 Chai Wan Rd,,,,
1619,EdgeConnex, USA, CA 95670, Rancho Cordova,10980 Gold Center Dr,28500.0,,1.5
1620,"TSR Solutions, Inc.", USA, WI, Milwaukee,324 East Wisconsin Avenue,5200.0,5200.0,
1621,Otava, Australia,Melbourne VIC,,,,,
1622,LeaseWeb, The Netherlands, 1119 NR Schiphol-Rijk,Capronilaan 2,,47361.0,,4.7
1623,IDC Chunghwa Telecom, Taiwan, Taipei City, Zhongzheng District, Xinyi Road,,,
1624,omart, United Kingdom, Saint Asaph LL17 0LJ,24 Ffordd Richard Davies,,1399.0,,
1625,Pulsant, UK, Rotherham, Wath upon Dearne, Manvers Roundabout,23681.0,,1.0
1626,"Superb Internet, A CherryRoad Company", USA, WA, Seattle,3311 South 120th Place,,,1.5
1627,Colo Locker - Evocative, USA, CA, Los Angeles,600 West 7th Street,,,
1628,IDC Chunghwa Telecom, Taiwan 320, Taoyuan City, Zhongli District, Zhongshan E Rd,8536.0,,
1629,myLoc a WIIT Company, Germany,85540 Haar,,,,1076.0,
1630,Mosaic Data Services, USA, DC,Washington D.C.,,,,
1631,myLoc a WIIT Company, Germany, 80939 München,Elisabeth-Selbert-Straße 7,,,3498.0,
1632,EvoSwitch, USA, MO, Kansas City,6301 Winchester Avenue,57000.0,13000.0,4.0
1633,IDC Chunghwa Telecom, Taiwan 710, Tainan City, Yongkang District, Zhongshan S Rd,16372.0,,
1634,uNetworks, Germany, Dortmund,Im Spähenfelde 51,,,3434.0,
1635,WowRack, USA, WA, Seattle,2001 6th Avenue,,60000.0,19.5
1636,uNetworks, Germany, Bremen,Hermann-Ritter-Straße 106,,,6738.0,
1637,"Superb Internet, A CherryRoad Company", USA, NY, New York, Pearl Street,,,40.0
1638,IDC Chunghwa Telecom, Taiwan 700, Tainan City, West Central District, Zhongshan Rd,,,
1639,Comarch ICT, Poland, 31-864 Kraków,Profesora Michała Życzkowskiego 21,,3229.0,,8.0
1640,Flexential, USA, Georgia 30122, Douglasville,1750 N River Rd,358000.0,,36.0
1641,Equinix, USA, WA, Seattle,2020 5th Avenue,58685.0,17750.0,7.5
1642,Equinix, Poland, Reguły,Aleje Jerozolimskie,,15242.0,,
1643,CoreSite, USA, CA, Los Angeles,900 Alameda Street,424000.0,,
1644,CoreSite, USA, DC, Washington,1275 K Street Northwest,22000.0,,
1645,Digital Realty, Germany, Frankfurt,Hanauer Landstraße 304,,,,
1646,Digital Realty, Ireland, Dublin, Cherry Orchard,24 Hume Avenue,2400.0,2400.0,
1647,Equinix, Japan, Tokyo, Koto City,Edagawa,78433.0,31502.0,4.05
1648,Neutron Colocation, USA, WA, Spokane,422 West Riverside Avenue,50000.0,2000.0,
1649,Expedient, USA, PA 15212, Pittsburgh,100 South Commons suite 001,50700.0,26000.0,4.2
1650,China Telecom, China, Beijing, Chaoyang District, 1 Jiuxianqiao East Road,,,
1651,China Telecom, China, Shanghai, Pudong Xinqu, Huajing Road,,,
1652,Sabey Data Centers, USA, NY 10038, New York, Pearl Street,,,
1653,DataBank, USA, TX, Dallas,1100 Empire Central Place,65000.0,35900.0,4.0
1654,China Telecom, China, Shanghai,Shanghai Shi,,,,
1655,PhoenixNAP, Singapore,Singapore Island,,,107666.0,,
1656,Equinix, USA, TX, Dallas,1950 North Stemmons Freeway,141096.0,107785.0,60.0
1657,Equinix, Australia, Mitchell ACT 2911,51 Dacre Street,,13480.0,5983.0,
1658,Equinix, Ireland, Dublin, Nangor, New Nangor Road,21132.0,21132.0,
1659,antage Data Centers, Hong Kong, Fanling, On Chuen Street,On Ting Industrial Centre,158000.0,,7.0
1660,Digital Realty, Germany, Frankfurt,Weismüllerstraße 21-23,,23000.0,,0.96
1661,QTS Data Centers, USA, Virginia 20166, Sterling,44874 Moran Road,87000.0,26820.0,6.0
1662,Digital Realty, Ireland, Dublin 12, Park West Industrial Park,35 Lavery Avenue,1100.0,1100.0,
1663,Evocative, USA, CA 90278, Redondo Beach,3690 Redondo Beach Avenue,104000.0,24345.0,7.5
1664,TierPoint, USA, WA, Seattle,100 4th Avenue North,33000.0,25000.0,
1665,antage Data Centers, Hong Kong, Fo Tan,8 Wong Chuk Yeung Street,,185000.0,,14.0
1666,1547 Critical Systems Realty, USA, HI, Kapolei,91-340 Farrington Hwy,10200.0,8350.0,2.0
1667,DataBank, USA, GA 30336, Atlanta,4764 Bakers Ferry Rd SW,200000.0,150000.0,48.0
1668,SBA Edge, USA, FL, Jacksonville,421 West Church Street,280000.0,,9.0
1669,rne Global, Iceland, Reykjanesbær, 262,Valhallarbraut 868,,,100.0
1670,TierPoint, USA, NC 27709, Durham,99 TW Alexander Drive,70000.0,34000.0,
1671,Equinix, Canada, AB T2C 2R6, Calgary,5300 86 Ave SE,42882.0,,
1672,atNorth, Iceland, 221 Hafnarfjörður,Steinhella 10,,,29062.0,3.2
1673,OneNeck IT Solutions, USA, MN 55344, Eden Prairie,10290 W 70th St,50000.0,,
1674,Flexential, USA, GA, Douglasville,1700 N River Rd,205000.0,205000.0,22.5
1675,Cologix, Canada, BC, Vancouver,1050 West Pender Street,15000.0,,2.0
1676,Equinix, UK, London, Coronation Road, Matrix Estate.,41979.0,29062.0,3.96
1677,DataBank, USA, GA, Atlanta,1150 White Street Southwest,75000.0,47160.0,6.0
1678,Digital Realty, USA, OR 97124, Hillsboro,5870 Northeast Schaaf Street,560000.0,,32.0
1679,IP House, UK, London,20 Lanrick Rd,,16000.0,14000.0,2.0
1680,Cologix, USA, FL, Jacksonville,4800 Spring Park Road,125000.0,125000.0,
1681,Opus Interactive, USA, OR, Hillsboro,8135 Northeast Evergreen Parkway,345000.0,110000.0,24.0
1682,China Telecom, China, Tianjin, Hedong District,11 Liujing Road,,,
1683,Cirion Technologies, Colombia, Bogotá, Bogotá, Suba,599.0,3216.0,3.0
1684,ScaleMatrix, USA, CA, San Diego,5775 Kearny Villa Road,50000.0,,20.0
1685,Zenlayer, Nigeria, Lagos,Chief Chuks Ikokwu Street,,,,
1686,Liquid Web, USA, MI, Lansing,4428 South Creyts Road,90000.0,,13.5
1687,1547 Critical Systems Realty, USA, WI, Milwaukee,324 East Wisconsin Avenue,160000.0,,12.0
1688,Flexential, USA, NV 89101, Las Vegas,304 E Carson Ave suite 370,33135.0,13718.0,1.37
1689,Evocative, USA, CA 95054, Santa Clara,2151 Mission College Blvd,73000.0,,9.0
1690,Hivelocity, USA, VA 20191, Reston,12100 Sunrise Valley Drive,,,
1691,atNorth, Iceland,Akureyri,,,,72656.0,12.0
1692,Netrality Data Centers, USA, TX, Houston,1301 Fannin Street,784143.0,231700.0,26.0
1693,MOD Mission Critical, India, Karnataka, Bengaluru, Brookefield,,,5.5
1694,NETdepot, USA, GA 30310, Atlanta,1100 White Street Southwest,,,
1695,Expedient, USA, OH, Cleveland,15248 Neo Parkway,24850.0,12500.0,2.0
1696,China Telecom, Japan, Tokyo, Koto City,Shiohama,,,
1697,Zenlayer, France, 95700 Roissy-en-France,167 Rue de la Belle Étoile,,,,
1698,Lumen, USA, NY, Rochester,150 Mile Crossing Blvd,23614.0,16318.0,
1699,Digital Realty, USA, VA 20147, Ashburn,44100 Digital Loudoun Plaza bldg j,226015.0,214820.0,26.4
1700,TierPoint, USA, KS, Lenexa,14500 West 105th Street,58000.0,11000.0,
1701,China Telecom, Germany, 64546 Mörfelden-Walldorf,Starkenburgstraße 12,,,,
1702,Iron Mountain Data Centers, USA, VA, Manassas,8330 Bethlehem Road,,,36.0
1703,olico Data Center, USA, FL 33064, Deerfield Beach,500 Green Road,140000.0,12000.0,48.0
1704,FirstLight, USA, NH, Manchester,77 Sundial Avenue,14400.0,,
1705,Aligned Data Centers, USA, IL, Northlake,505 Northwest Avenue,220000.0,,36.0
1706,Equinix, USA, TX, Dallas,1950 North Stemmons Freeway,33564.0,24542.0,60.0
1707,Stellar Technologies Inc., USA, HI, Honolulu,3375 Koapaka Street,,,
1708,Equinix, China, Shanghai, Pudong,700 Jinyu Road,36966.0,13108.0,2900.0
1709,Equinix, Chile, Región Metropolitana, Santiago, of 105,15769.0,,
1710,Deft, USA, IL, Elk Grove Village,2200 Busse Road,485000.0,275000.0,36.4
1711,Enzu, USA, OR, Hillsboro,23605 Northeast Huffman Street,,,
1712,Equinix, USA, CA, Los Angeles,818 West 7th Street,33080.0,13819.0,0.7
1713,Equinix, USA, CA, Santa Clara,2970 Corvin Drive,44231.0,28511.0,
1714,Cloudsmart, USA, CT, Branford,4 Pin Oak Drive,20000.0,,1.0
1715,China Telecom, China, Guangdong Sheng, Shenzhen Shi, Futian Qu,,,
1716,QuadraNet, USA, GA, Atlanta,55 Marietta Street NorthWest,300000.0,,
1717,Prime Data Centers, USA, CA, Santa Clara,1111 Comstock Street,121000.0,,9.0
1718,Digital Realty, UK, Crawley RH10 9BE, Power Ave, Digital Realty Unit 1,119500.0,,18.0
1719,Flexential, USA, CO, Englewood,8636 South Peoria Street,240549.0,140000.0,18.0
1720,Lumen, USA, DE, Newark,442-482 Interchange Boulevard,17440.0,3300.0,
1721,FirstLight, USA, NH, Keene,310 Marlboro Street,1500.0,,
1722,Iron Mountain Data Centers, USA, FL, Miami,2925 Northwest 120th Terrace,150000.0,,16.0
1723,Tel Networks Inc., USA, NY, Buffalo,350 Main Street,,,
1724,China Telecom, USA, CA 95054, Santa Clara,4700 Old Ironsides Dr,,,
1725,TierPoint, USA, SD, Sioux Falls,700 East 54th Street North,17000.0,4200.0,
1726,ScaleMatrix, USA, FL, Jacksonville,8324 Baymeadows Way,119961.0,,12.0
1727,China Telecom, China, Fujian, Longyan,Xinluo,,,
1728,MOD Mission Critical, India, Maharashtra, Navi Mumbai, Rabale,32292.0,21527.0,2.0
1729,MOD Mission Critical, Canada, BC, Vancouver,555 West Hastings Street #1460,5000.0,,
1730,Digital Realty, Brazil, 13185-252, Hortolândia - SP, 4 - Jardim Santa Izabel,43000.0,,10.0
1731,24Shells Inc, USA, NY, New York, Hudson Street,,,
1732,LightEdge, USA, KS, Lenexa,17501 West 98th Street,102287.0,47395.0,2.9
1733,NETdepot, USA, CA 94539, Fremont,760 Mission Ct,,,
1734,Data Canopy, USA, CA 94107, San Francisco,630 3rd Street,,20000.0,4.3
1735,Zenlayer, China, Beijing, Daxing District,15 Tong Ji Zhong Lu,,,
1736,China Telecom, Japan, Tokyo, Chiyoda City,Ōtemachi,,,
1737,Hivelocity, Italy, MI, 20144 Milano, 125,,,
1738,China Telecom, Apple Store, Jiankang Road, Zhongshan Road, Liangxi District,,,
1739,FirstLight, USA, NY, Albany,11 North Pearl Street,8000.0,,
1740,Cogent Communications,15 Lyoner Straße,,,,2303.0,2303.0,
1741,Netshop ISP, Cyprus,Larnaca,,,,,
1742,Prime Data Centers, USA, AZ, Avondale,11753 West Lower Buckeye Road,264000.0,128000.0,48.0
1743,China Telecom, China, Sichuan Sheng, Chengdu Shi, Qingyang Qu,,,
1744,China Telecom, USA, CA 95119, San Jose,11 Great Oaks Blvd,,,
1745,CoreSite, USA, CA, Santa Clara,3035 Stender Way,162000.0,,
1746,China Telecom, China, Shanghai, Huangpu Qu, Zhongshan South Road,,,
1747,Cogent Communications, USA, WI, Milwaukee,324 East Wisconsin Avenue,608.0,608.0,
1748,Enzu, USA, MN, Chaska,3500 Lyman Blvd,,,
1749,Zenlayer, USA, FL, Miami,2115 Northwest 22nd Street,,,
1750,Cogent Communications, France,Montpellier,,,,,
1751,Digital Realty, South Africa, Cape Town, Rondebosch, M4,65659.85,,5.0
1752,Navegalo, Costa Rica, San José, San José Province,Paseo Colón 2,,,
1753,Hivelocity, USA, CA 94089, Sunnyvale,444 Toyama Drive,,,
1754,Psychz Networks, South Africa, 1600, Kempton Park, Isando,,,
1755,"Ascenty, a Digital Realty Company", Brazil, 61921-430, Fortaleza - CE, 1161,97000.0,,10.0
1756,Limestone Networks, USA, TX, Dallas,1950 North Stemmons Freeway,,,
1757,Digital Realty, Brazil, 13185-252, Hortolândia - SP, 4 - Jardim Santa Izabel,32000.0,,3.0
1758,Prov.net/IronTrust Networks, USA, RI, Providence,304 Carpenter Street,10000.0,6000.0,1.0
1759,Cogent Communications, USA, VA, Herndon,510 Huntmar Park Drive,60421.0,60421.0,
1760,Fortress Data Centers, USA, CA, San Francisco,274 Brannan Street,105225.0,20000.0,3.5
1761,Zenlayer, India, Telangana 500081, Hyderabad, Madhapur,,,
1762,CyberNest, USA, GA, Atlanta,345 Courtland Street Northeast,110000.0,45000.0,3.0
1763,"Ascenty, a Digital Realty Company", Brazil, Jundiaí - State of São Paulo,Rua Presbítero Plinio Alves de Souza - Jardim Ermida I,,75347.37,,15.0
1764,DataBank, USA, UT, Salt Lake, Bluffdale,275000.0,43820.0,3.25
1765,Infinite Chain, România, 535700 Zencani,Strada Aluniş 19,,58125.0,,50.0
1766,Flexential, USA, UT 84042, Lindon,333 South 520 West #150,9542.0,6336.0,0.57
1767,Rackspace, Australia, Erskine Park NSW 2759,1-11 Templar Rd,,5166.0,,5.6
1768,Cologix, USA, OH, Columbus,555 Scherers Court,20000.0,20000.0,
1769,H5 Data Centers, USA, TN, Nashville,211 Commerce Street,22000.0,,
1770,Colocation America, USA, CT, Waterbury,108 Bank St,30000.0,8000.0,
1771,DC BLOX, USA, AL, Birmingham,433 6th Street,31000.0,15000.0,5.0
1772,Involta, USA, OH,Independence,,23000.0,10000.0,1.0
1773,Flexential, USA, OR 97124, Hillsboro,3935 NE Aloclek Dr,85388.0,138000.0,5.3
1774,Zenlayer, Indonesia, Jakarta 13340, East Jakarta City, Jatinegara,,,
1775,Quest Technology Management, USA, CA, McClellan Park,4235 Forcum Ave,,,
1776,Telia Company, Germany, Düsseldorf,In der Steele 43,,,,
1777,CoreSite, USA, FL, Miami,2115 Northwest 22nd Street,43000.0,,
1778,LightEdge, USA, CA, San Diego,9305 Lightwave Avenue,100000.0,56432.0,2.9
1779,Cirion Technologies, Venezuela, Capital District, Caracas, La Urbina,14999.0,7216.0,2.0
1780,China Telecom, South Korea, Seoul, Mapo-gu, Seogyo-dong,,,
1781,FOGO Solutions, USA, GA 30303, Atlanta,56 Marietta St NW,,,
